{
  "jobId": "VF-R003",
  "format": "reel",
  "status": "ready_for_publish",
  "sourceEvidence": [
    "drive:1V5daU2XcB0kMsDo_erzv3AkumElfmrr5:IMG_0470.mov",
    "source-sha256:46aebae371fe92adcaf9c684ecc62944dd34d5787c5cbaf395cc5334652004b5",
    "verified-source-audio:none",
    "final-package-sha256:ceb58af7ee16c579561878768f0d21822f83530fbf9c7867f5394072d5f52904",
    "caption-sha256:03613b04342f74e9a6593ff81fc17f78e2aadcc79fc4d03b6672891a99a781bc",
    "audio-receipt-drive:1NmOPEEHc7SzI2DFEc8Q4CRxLYBEStrFw",
    "render-receipt-drive:1C_DtQYi3qCEOenoyVOQ8cgdolgeqS-Sq",
    "visible-text-receipt-drive:1ZMZPRkBfujp8cNZr4l1vYGUTmdb_pnzL",
    "package-manifest-drive:1JKvkZpiM4jfkuiajSsc1XDmqUMdvkhz7",
    "owner-preference:2026-09-11:cover-copy=פה הזווית משנה הכול"
  ],
  "visualStandard": {
    "gate": "PASS",
    "document": "packages/vfom/OWNER-APPROVED-GRID-STANDARD-2026-09-14.md",
    "portablePrompt": "packages/vfom/VELVET-VISUAL-SYSTEM-PROMPT.md",
    "referenceAsset": "packages/vfom/reference/velvet-approved-grid-2026-09-14.jpg",
    "publicReferenceUrl": "https://raw.githubusercontent.com/nocturney/velvetos-core/main/packages/vfom/reference/velvet-approved-grid-2026-09-14.jpg",
    "artifactSha256": "df41281b44e2c1ac99a1cb0c9f084ec926c30774f61468fc8988f59c5a136897",
    "coldStart": true,
    "evidenceRefs": [
      "packages/vfom/OWNER-APPROVED-GRID-STANDARD-2026-09-14.md",
      "packages/vfom/reference/velvet-approved-grid-2026-09-14.jpg"
    ]
  },
  "concept": {
    "coreIdea": "Use the real changing viewpoints and reflected highlights on the helmet form as a controlled visual reveal without inventing a finishing process.",
    "emotion": "precision and visual richness",
    "formatGenome": "VISUAL_DETAIL_ROTATION",
    "objective": "show real detail through changing angle and light while avoiding unsupported material/process claims",
    "audience": "people drawn to detailed decorative 3D-printed forms and close-up craft visuals"
  },
  "hook": {
    "candidates": [
      {
        "id": "h1-no-text",
        "visual": "front-to-three-quarter move where highlights change visibly",
        "text": "",
        "reason": "clean baseline; the subject can carry the opener"
      },
      {
        "id": "h2",
        "visual": "side detail as angle changes",
        "text": "פרט אחד, זווית אחרת",
        "reason": "accurate but more editorial than conversational"
      },
      {
        "id": "h3-owner",
        "visual": "front-to-three-quarter move where highlights change most clearly",
        "text": "פה הזווית משנה הכול",
        "reason": "owner-selected and states the point without inventing a process claim"
      }
    ],
    "selected": "h3-owner"
  },
  "shots": {
    "plan": [
      {
        "assetRef": "drive:1V5daU2XcB0kMsDo_erzv3AkumElfmrr5",
        "shotType": "hero",
        "orientation": "vertical",
        "angle": "front to three-quarter",
        "distance": "medium-close",
        "action": "start on the strongest front view and move immediately into angle change",
        "targetDurationSec": 2.0,
        "proof": "real object and changing highlights"
      },
      {
        "assetRef": "drive:1V5daU2XcB0kMsDo_erzv3AkumElfmrr5",
        "shotType": "macro",
        "orientation": "vertical",
        "angle": "side/front detail",
        "distance": "close",
        "action": "show ornament and dark crest from the side",
        "targetDurationSec": 3.0,
        "proof": "real visible surface and crest detail"
      },
      {
        "assetRef": "drive:1V5daU2XcB0kMsDo_erzv3AkumElfmrr5",
        "shotType": "proof",
        "orientation": "vertical",
        "angle": "rear to opposite side",
        "distance": "medium-close",
        "action": "complete the viewpoint change",
        "targetDurationSec": 3.486,
        "proof": "same real object from multiple continuous viewpoints"
      }
    ],
    "missing": []
  },
  "edit": {
    "durationTargetSec": 8.486,
    "audioStrategy": "Source contains no audio stream. Exact final uses original procedural non-diegetic subtle metallic shimmer/pings authored for the angle reveal, normalized and muxed as AAC mono 48kHz; mean -17.9 dB, max -1.8 dB. Not claimed as source sound or trending music.",
    "timeline": [
      {
        "startSec": 0.0,
        "endSec": 2.0,
        "assetRef": "drive:1V5daU2XcB0kMsDo_erzv3AkumElfmrr5",
        "crop": "vertical 9:16 crop preserving front silhouette",
        "speed": 1.5,
        "cut": "hard",
        "audio": "original-procedural-metallic-sfx"
      },
      {
        "startSec": 2.0,
        "endSec": 5.0,
        "assetRef": "drive:1V5daU2XcB0kMsDo_erzv3AkumElfmrr5",
        "crop": "tight detail crop on side ornament and crest",
        "speed": 1.5,
        "cut": "hard",
        "audio": "original-procedural-metallic-sfx"
      },
      {
        "startSec": 5.0,
        "endSec": 8.486,
        "assetRef": "drive:1V5daU2XcB0kMsDo_erzv3AkumElfmrr5",
        "crop": "medium-close crop completing the rotation",
        "speed": 1.5,
        "cut": "hard",
        "audio": "original-procedural-metallic-sfx"
      }
    ]
  },
  "overlays": [],
  "visualCopy": {
    "decision": "TEXT_WINS",
    "selectedText": "פה הזווית משנה הכול",
    "noTextCompared": true,
    "pipeline": [
      "reader-first-he",
      "velvet-hebrew-copy",
      "ai-tells-he",
      "owner-preference-lock",
      "brand-guardian-final-review"
    ],
    "candidates": [
      {
        "text": "",
        "result": "baseline",
        "reason": "clean visual baseline remains viable"
      },
      {
        "text": "נראה אחרת בתנועה",
        "result": "rejected",
        "reason": "generic and mostly descriptive"
      },
      {
        "text": "פה הזווית משנה הכול",
        "result": "selected",
        "reason": "owner-selected and passes current visual-microcopy gate"
      }
    ],
    "ownerPreference": "פה הזווית משנה הכול",
    "readerFirstNote": "The viewer can see one object change with angle; copy should explain why the rotation matters, not invent a finish claim.",
    "humanizerNote": "Current-main visible-text gate passed the exact visual microcopy.",
    "decisionRationale": "TEXT_WINS over the no-text baseline on the reviewed cover."
  },
  "cover": {
    "candidates": [
      {
        "id": "c0-no-text",
        "headline": "",
        "subjectCrop": "real rear/side helmet frame",
        "textPlacement": "none",
        "gridRationale": "clean baseline"
      },
      {
        "id": "c1",
        "headline": "פרט אחד, זווית אחרת",
        "subjectCrop": "real side ornament frame",
        "textPlacement": "upper safe zone",
        "gridRationale": "accurate but too editorial"
      },
      {
        "id": "c2-owner",
        "headline": "פה הזווית משנה הכול",
        "subjectCrop": "real rear/side frame showing the crest and metallic detail",
        "textPlacement": "upper safe zone with readability scrim",
        "gridRationale": "owner-selected; exact final reviewed"
      }
    ],
    "selected": "c2-owner"
  },
  "finishing": {
    "policyVersion": 1,
    "principle": "Retouch the photo, not the product.",
    "stages": {
      "photoRetouch": "PASS",
      "brandContentStyling": "PASS",
      "textLayoutQa": "PASS",
      "finalVisualQa": "PASS"
    },
    "productTruth": {
      "gate": "PASS",
      "subjectIdentityIntegrity": "PASS",
      "syntheticSubjectChange": "NONE",
      "sourceSubjectMatch": "PASS",
      "colorPreserved": "PASS",
      "notes": "Real source object only; rotation crop/timing/cover treatment does not alter the product."
    },
    "repairCycles": 1,
    "lastRepairAction": "Re-rendered with intentional original SFX, showcase caption and owner-selected cover; rebound exact hashes.",
    "reviewedArtifactDigest": "sha256:ceb58af7ee16c579561878768f0d21822f83530fbf9c7867f5394072d5f52904",
    "evidenceRefs": [
      "drive:1q9NT54HrwDsC4hy1kziML-boa1mgcbPa",
      "drive:1D-kh0iMJKFVuYzh60Cwrrr0iClMQBrMo",
      "drive:1C_DtQYi3qCEOenoyVOQ8cgdolgeqS-Sq"
    ]
  },
  "qa": {
    "brandScore": 88,
    "hookScore": 87,
    "realityScore": 98,
    "originalityScore": 85,
    "artifactScore": 94,
    "deterministicChecks": {
      "state": "pass",
      "validatorHead": "8f171ee8fa103f49dc929fa0dc8af98b799e3b86",
      "exactFinalPackageSha256": "ceb58af7ee16c579561878768f0d21822f83530fbf9c7867f5394072d5f52904",
      "video": "1080x1920 H.264 8.486s",
      "videoSha256": "c5a3c14ffe0802a43ac97752274bd8c1fd66f5a5f014f655726663d4215aa643",
      "coverSha256": "403f0609081ff45231032fb056f0ecde2ba55afdfeac30c677ef549b4964606c",
      "captionSha256": "03613b04342f74e9a6593ff81fc17f78e2aadcc79fc4d03b6672891a99a781bc",
      "caption": "PASS_SHOWCASE_NON_TRANSACTIONAL",
      "audioStream": "AAC mono 48kHz",
      "audioMeanVolumeDb": -17.9,
      "audioMaxVolumeDb": -1.8,
      "audioGate": "PASS",
      "visualCopyGate": "PASS_TEXT_WINS",
      "productTruthGate": "PASS",
      "readability": "PASS",
      "contrast": "PASS",
      "executionReceipt": "PASS_CURRENT_MAIN"
    },
    "failures": [],
    "repairs": [
      "Did not treat missing source audio as acceptable silence.",
      "Added original non-diegetic metallic SFX and reran audio measurements.",
      "Rewrote caption as showcase copy and reran current-main Visible Text Gate.",
      "Rendered owner-selected cover and rebound exact hashes/receipts."
    ]
  },
  "feed": {
    "continuityDecision": "pass",
    "reasoning": "Warm metallic detail and viewpoint change are visually distinct from R001 movement and the R002 no-text dark carousel, while coexisting with the retained live Reel baseline."
  },
  "derivativeRefs": [
    "drive:1q9NT54HrwDsC4hy1kziML-boa1mgcbPa:VF-R003-final.mp4:sha256=c5a3c14ffe0802a43ac97752274bd8c1fd66f5a5f014f655726663d4215aa643",